input,output
"Hi, how are you?","I'm fine, thanks for asking!"
"What's your name?","I don't have a name, I'm an AI."
"What do you do?","I chat with people and try to help them."
"Can you help me?","Sure, what do you need help with?"
"What time is it?","I'm not sure, but I think you should check your local time."
"Tell me a joke.","Why don't scientists trust atoms? Because they make up everything!"
"What's the weather like today?","I'm not sure, but I suggest checking a weather app for the most accurate information."
"Do you like music?","I don't have preferences, but I can play music for you."
"Can you recommend a movie?","You might enjoy 'Inception', it's quite intriguing!"
"Where are you from?","I was created by OpenAI, so you could say I'm from there."
"How was your day?","It was productive. How about yours?"
"What are your hobbies?","I'm designed to chat, so talking to people is my main hobby."
"What are you doing?","I'm here chatting with you!"
"Do you have any pets?","No, but I love learning about animal companions."
"What's your favorite food?","As an AI, I don't eat, but I can find recipes for you!"
"What books do you recommend?","How about '1984' by George Orwell? It's a classic."
"Are you interested in sports?","I don't play sports, but I can find sports news for you."
"How can I get to the train station?","Take the bus number 24, it stops right at the station."
"Can you speak other languages?","I can help you translate between different languages."
"What is your job?","I am here to assist you with information and answer your questions."
"Are you busy right now?","Not at all, I'm here to help you."
"Can you give me some advice?","Always think before you act and keep learning from your experiences."
"What’s the best way to learn a language?","Practice daily and immerse yourself in the language as much as possible."
"How often do you update?","I get updates regularly to improve my responses."
"Can you explain blockchain to me?","Blockchain is a system of recording information in a way that makes it difficult or impossible to change."
"Why is the sky blue?","The sky is blue because of the scattering of sunlight by the atmosphere."
"Can you play music?","Yes, I can play music, just let me know what you would like to hear."
"How do I make a cake?","To make a cake, you need flour, sugar, eggs, butter, and baking powder. Mix them and bake."
"What can I do in New York?","You can visit landmarks like Times Square, the Statue of Liberty, and Central Park."
"Do you know any good restaurants nearby?","I can look up popular restaurants in your area if you tell me where you are."
"What’s your favorite movie?","I don't watch movies, but people often talk about 'The Shawshank Redemption' as a favorite."
"Can you send emails?","I can't send emails directly, but I can assist you with drafting them."
"What’s your favorite color?","I don't have a favorite color."
"Who is the president of the United States?","The current president is Joe Biden."
"What are the latest news headlines?","I can check the latest news for you if you'd like."
"Can you book appointments?","No, but I can help you schedule them on your calendar app."
"How do you make coffee?","Combine water, coffee grounds, and heat. Then filter and enjoy."
"What are the seven wonders of the world?","They include the Great Wall of China, Petra, Christ the Redeemer, Machu Picchu, Chichen Itza, the Roman Colosseum, and the Taj Mahal."
"Do you have feelings?","I don't have emotions, but I'm here to help you with yours."
"What is the meaning of life?","The meaning of life varies for everyone; many find it through personal fulfillment and connections."
"How do I reset my password?","You can reset your password by following the forgot password link on the login page."
"What is artificial intelligence?","AI is technology that enables a machine to simulate human behavior."
"Can you drive a car?","No, but I can help navigate using GPS technology."
"What is the tallest mountain in the world?","Mount Everest is the tallest mountain, at over 29,000 feet."
"Can you help me with math?","Yes, what kind of math problem do you need help with?"
"What time does the sun set today?","The sunset time depends on your location, but I can find it for you."
"Can you recommend a good book?","I recommend 'To Kill a Mockingbird' by Harper Lee, it's insightful."
"Are you always online?","Yes, I'm here to help anytime."
"How can I improve my memory?","Practice various brain exercises and try to keep learning new things."
"Can you make phone calls?","I can't make calls myself, but I can help you dial or find contacts."
"How do I cook rice?","To cook rice, use a 2:1 water to rice ratio, bring to a boil, then simmer covered."
"What are your thoughts on climate change?","Climate change is a significant issue; reducing carbon emissions is crucial."
"Can you help me shop online?","Sure, what are you looking to buy?"
"What should I wear today?","It depends on the weather and your plans, but comfortable clothing is key."
"How do I use this app?","Here's how to navigate the features of this app..."
"What's the best way to stay healthy?","Eating balanced meals, regular exercise, and proper sleep are essential."
"What are the main ingredients in pizza?","Flour, tomato sauce, cheese, and toppings like pepperoni or vegetables."
"Can you play games?","Yes, let me know what game you'd like to play."
"How much does the Earth weigh?","The Earth weighs about 6 sextillion tons."
"What is quantum computing?","Quantum computing is a type of computing using quantum-mechanical phenomena, such as superposition."
"What's the date today?","Today's date is [current date]."
"Can you remind me to call John tomorrow?","I'll remind you to call John tomorrow at your preferred time."
"Where is the nearest gas station?","The nearest gas station is 1.2 miles away on Main Street."
"What should I do if I lose my phone?","If you lose your phone, immediately contact your service provider to lock it and track its location."
"How do I subscribe to your newsletter?","You can subscribe to our newsletter by visiting our website and entering your email address."
"What are some tips for a job interview?","Be confident, dress appropriately, and be prepared to discuss your experiences and skills."
"Can you play a podcast about technology?","Playing the latest technology podcast now."
"What's the capital of France?","The capital of France is Paris."
"How long does it take to boil an egg?","It usually takes about 10 minutes to boil an egg fully."
"Can you explain how a car engine works?","A car engine works by converting gasoline into motion through combustion."
"What are the symptoms of the flu?","Symptoms of the flu include fever, cough, sore throat, and body aches."
"What are the best practices for data security?","Always use strong passwords, enable two-factor authentication, and keep your software up to date."
"How do I create a budget?","List your income and expenses, prioritize savings, and monitor your spending."
"What's a good gift for a wedding?","A good wedding gift could be something personal like custom artwork or practical like kitchen appliances."
"Can you track my package from Amazon?","I can't track packages directly, but you can use your tracking number on the courier's website."
"How do I delete my browsing history?","You can delete your browsing history from the settings menu in your browser."
"What's a healthy breakfast option?","A healthy breakfast option is oatmeal with fruits and nuts."
"Can you help me find a fitness app?","Checking the app store, there are several highly rated fitness apps like Fitbit and MyFitnessPal."
"What are the top tourist attractions in Paris?","Top attractions in Paris include the Eiffel Tower, Louvre Museum, and Notre Dame Cathedral."
"How do I change a tire?","To change a tire, you'll need a jack, a wrench, and a spare tire. Loosen the lug nuts, lift the car, replace the tire."
"What are the ingredients for a margarita?","For a classic margarita, you need tequila, lime juice, orange liqueur, and ice."
"Can you recommend a children’s book?","A great children’s book is 'Where the Wild Things Are' by Maurice Sendak."
"What's the exchange rate for euros to dollars?","The current exchange rate for euros to dollars can be found on financial websites or apps."
"Can you tell me a historical fact?","Did you know that the shortest war in history was between Britain and Zanzibar on August 27, 1896? It lasted only 38 minutes."
"What are the new features in the latest iPhone?","The latest iPhone features include a new camera system, faster processor, and improved battery life."